{
  "name": "ocx.sh/mozilla/sccache",
  "repository": "oci://ghcr.io/ocx-contrib/mozilla/sccache",
  "owners": [
    {
      "github": "ocx-bot",
      "github_id": 309019509
    }
  ],
  "status": "active",
  "deprecated_message": null,
  "created": "2026-08-02",
  "desc": null,
  "upstream": {
    "org": "mozilla",
    "repository_url": "https://github.com/mozilla/sccache",
    "disclaimer": "Unaffiliated mirror. sccache is a project of Mozilla; this OCX package republishes upstream release binaries and is not endorsed by them."
  },
  "tags": {}
}
