{
  "name": "ocx.sh/kubectx/kubectx",
  "repository": "oci://ghcr.io/ocx-contrib/kubectx/kubectx",
  "owners": [
    {
      "github": "ocx-bot",
      "github_id": 309019509
    }
  ],
  "status": "active",
  "deprecated_message": null,
  "created": "2026-08-04",
  "desc": {
    "digest": "sha256:aa265afa26acda6af92d3764fe5c2e550649f46ac76515bed4d74208fd709f26",
    "title": "kubectx",
    "description": "Switch between kubectl contexts (clusters) fast, rename and delete them, or open a shell scoped to one",
    "keywords": [
      "kubectx",
      "kubectl",
      "kubernetes",
      "k8s",
      "context",
      "cluster",
      "kubeconfig",
      "cli",
      "devops"
    ],
    "readme": "sha256:f01372b578457cdabef5a3750e83b4ceacc8990682579056951597a5935d5128",
    "logo": "sha256:c9678078ba0c7752b0a4e19ba65b56d06d7faf6e27ed51a6a45118cded28410f"
  },
  "upstream": {
    "org": "ahmetb",
    "repository_url": "https://github.com/ahmetb/kubectx",
    "disclaimer": "Unaffiliated mirror. kubectx is a project of Ahmet Alp Balkan, copyright Google LLC; this OCX package republishes upstream release binaries and is not endorsed by them."
  },
  "tags": {
    "0.10.0_20260804": {
      "content": "sha256:0f4123a9912ae5d8f714f76293fa102aa303d974ea8521baeb6729910ab36da5",
      "observed": "2026-08-04T01:47:33Z"
    },
    "0.10.0": {
      "content": "sha256:0f4123a9912ae5d8f714f76293fa102aa303d974ea8521baeb6729910ab36da5",
      "observed": "2026-08-04T01:47:33Z"
    },
    "0.10": {
      "content": "sha256:8528b9affebfe191c470d282661f0a5b46ef42e28a1efd1c683f3fb529162b4c",
      "observed": "2026-08-04T01:47:33Z"
    },
    "0": {
      "content": "sha256:fc600d91cbf98bbbfbab355e634019ad6fee8f3729bf726d2014e3002dc95f18",
      "observed": "2026-08-04T01:47:33Z"
    },
    "latest": {
      "content": "sha256:fc600d91cbf98bbbfbab355e634019ad6fee8f3729bf726d2014e3002dc95f18",
      "observed": "2026-08-04T01:47:33Z"
    },
    "0.10.2_20260804": {
      "content": "sha256:8528b9affebfe191c470d282661f0a5b46ef42e28a1efd1c683f3fb529162b4c",
      "observed": "2026-08-04T01:47:33Z"
    },
    "0.10.2": {
      "content": "sha256:8528b9affebfe191c470d282661f0a5b46ef42e28a1efd1c683f3fb529162b4c",
      "observed": "2026-08-04T01:47:33Z"
    },
    "0.11.0_20260804": {
      "content": "sha256:fc600d91cbf98bbbfbab355e634019ad6fee8f3729bf726d2014e3002dc95f18",
      "observed": "2026-08-04T01:47:33Z"
    },
    "0.11.0": {
      "content": "sha256:fc600d91cbf98bbbfbab355e634019ad6fee8f3729bf726d2014e3002dc95f18",
      "observed": "2026-08-04T01:47:33Z"
    },
    "0.11": {
      "content": "sha256:fc600d91cbf98bbbfbab355e634019ad6fee8f3729bf726d2014e3002dc95f18",
      "observed": "2026-08-04T01:47:33Z"
    }
  }
}
