{
  "name": "ocx.sh/hashicorp/terraform",
  "repository": "oci://ghcr.io/ocx-contrib/terraform",
  "owners": [
    {
      "github": "alice",
      "github_id": 1
    }
  ],
  "status": "active",
  "deprecated_message": null,
  "created": "2025-03-01",
  "desc": {
    "digest": "sha256:eeeeeeeeeeeeeeeeeeeeeeeeeeeeeeeeeeeeeeeeeeeeeeeeeeeeeeeeeeeeeeee",
    "title": "Terraform",
    "description": "Infrastructure as code, multi-cloud provisioning.",
    "keywords": [
      "iac",
      "cloud",
      "provisioning"
    ]
  },
  "tags": {
    "latest": {
      "content": "sha256:f28ea9c95fa62c852866e653121ca6e51cf8f18e7adf8b9d5b94e4902b6297bf",
      "observed": "2026-07-10T00:00:00Z"
    },
    "1.9.0": {
      "content": "sha256:f28ea9c95fa62c852866e653121ca6e51cf8f18e7adf8b9d5b94e4902b6297bf",
      "observed": "2026-07-10T00:00:00Z"
    },
    "1.8.0": {
      "content": "sha256:f17ea26b3dec978e8feedffaac2f5eb3cc558d57d9c56d9cd122572c16694e0c",
      "observed": "2026-06-01T00:00:00Z"
    }
  }
}
