{
  "name": "ocx.sh/shellcheck/shellcheck",
  "repository": "oci://ghcr.io/ocx-contrib/shellcheck/shellcheck",
  "owners": [
    {
      "github": "ocx-bot",
      "github_id": 309019509
    }
  ],
  "status": "active",
  "deprecated_message": null,
  "created": "2026-08-02",
  "desc": null,
  "upstream": {
    "org": "koalaman",
    "repository_url": "https://github.com/koalaman/shellcheck",
    "disclaimer": "Unaffiliated mirror. ShellCheck is a project of Vidar Holen; this OCX package republishes upstream release binaries and is not endorsed by them."
  },
  "tags": {}
}
