{
  "name": "ocx.sh/shfmt/shfmt",
  "repository": "oci://ghcr.io/ocx-contrib/shfmt/shfmt",
  "owners": [
    {
      "github": "ocx-bot",
      "github_id": 309019509
    }
  ],
  "status": "active",
  "deprecated_message": null,
  "created": "2026-08-02",
  "desc": {
    "digest": "sha256:4fb50af0662add83368d6ef30f1f7082bc0bc673fe84d89402633f0e03dd1af0",
    "title": "shfmt",
    "description": "A shell parser and formatter with POSIX shell, Bash, and mksh support",
    "keywords": [
      "shfmt",
      "shell",
      "bash",
      "mksh",
      "posix",
      "formatter",
      "parser",
      "sh",
      "format",
      "lint"
    ],
    "readme": "sha256:ccfcd6069a24cf704c6d2d40aa84065445b184dbba8e603ae1440d2534d9b846",
    "logo": "sha256:45af2a765ce20eee0fc499e0cdecc4df61d10cae3925364fab504b62ae9c9098"
  },
  "upstream": {
    "org": "mvdan",
    "repository_url": "https://github.com/mvdan/sh",
    "disclaimer": "Unaffiliated mirror. shfmt is part of the mvdan/sh project by Daniel Mart\u00ed; this OCX package republishes upstream release binaries and is not endorsed by them."
  },
  "tags": {
    "3.10.0": {
      "content": "sha256:97b4799d8f74f94bce8a09b9215c350d0feb7448662d99933fd8ca27b7d91400",
      "observed": "2026-08-02T10:11:43Z"
    },
    "3.10": {
      "content": "sha256:97b4799d8f74f94bce8a09b9215c350d0feb7448662d99933fd8ca27b7d91400",
      "observed": "2026-08-02T10:11:43Z"
    },
    "3": {
      "content": "sha256:3b3ea593c8f7a78f947aab6b251b9f104941eb8080982f008bae172a0a30ca92",
      "observed": "2026-08-02T10:11:43Z"
    },
    "latest": {
      "content": "sha256:3b3ea593c8f7a78f947aab6b251b9f104941eb8080982f008bae172a0a30ca92",
      "observed": "2026-08-02T10:11:43Z"
    },
    "3.11.0": {
      "content": "sha256:bae7cbcb795610031ab341aa6ce35c2c538aab41256ae82663b287f91953591a",
      "observed": "2026-08-02T10:11:43Z"
    },
    "3.11": {
      "content": "sha256:bae7cbcb795610031ab341aa6ce35c2c538aab41256ae82663b287f91953591a",
      "observed": "2026-08-02T10:11:43Z"
    },
    "3.12.0": {
      "content": "sha256:c9f46b0e3860090086533f89c4958a7c7ed0f0b5440ca0a029bc12f126607a0e",
      "observed": "2026-08-02T10:11:43Z"
    },
    "3.12": {
      "content": "sha256:c9f46b0e3860090086533f89c4958a7c7ed0f0b5440ca0a029bc12f126607a0e",
      "observed": "2026-08-02T10:11:43Z"
    },
    "3.13.0": {
      "content": "sha256:c5de3e7987546a5b245022897591b08f461df4627ece81e0a51303eac2e0bbb1",
      "observed": "2026-08-02T10:11:43Z"
    },
    "3.13": {
      "content": "sha256:3b3ea593c8f7a78f947aab6b251b9f104941eb8080982f008bae172a0a30ca92",
      "observed": "2026-08-02T10:11:43Z"
    },
    "3.13.1": {
      "content": "sha256:3b3ea593c8f7a78f947aab6b251b9f104941eb8080982f008bae172a0a30ca92",
      "observed": "2026-08-02T10:11:43Z"
    },
    "3.5.1": {
      "content": "sha256:410e32d61c3b5170dee21c37fe328eb69b278deefe5dff92747bf5db181e32a9",
      "observed": "2026-08-02T13:22:36Z"
    },
    "3.5": {
      "content": "sha256:410e32d61c3b5170dee21c37fe328eb69b278deefe5dff92747bf5db181e32a9",
      "observed": "2026-08-02T13:22:36Z"
    },
    "3.6.0": {
      "content": "sha256:d33737243bd62fc0ce4afab68e11f146ad07a64a659e0f603978946d5a65200c",
      "observed": "2026-08-02T13:22:36Z"
    },
    "3.6": {
      "content": "sha256:d33737243bd62fc0ce4afab68e11f146ad07a64a659e0f603978946d5a65200c",
      "observed": "2026-08-02T13:22:36Z"
    },
    "3.7.0": {
      "content": "sha256:4b2a21d922c53b7998e16b50f61d0dd0ce87850c7a7cea7b9e3cff710c73b142",
      "observed": "2026-08-02T13:22:36Z"
    },
    "3.7": {
      "content": "sha256:4b2a21d922c53b7998e16b50f61d0dd0ce87850c7a7cea7b9e3cff710c73b142",
      "observed": "2026-08-02T13:22:36Z"
    },
    "3.8.0": {
      "content": "sha256:e35d3c3cd96a2634a5411cd2dcdb877a583c85c3047756240d37b14af7609e73",
      "observed": "2026-08-02T13:22:36Z"
    },
    "3.8": {
      "content": "sha256:e35d3c3cd96a2634a5411cd2dcdb877a583c85c3047756240d37b14af7609e73",
      "observed": "2026-08-02T13:22:36Z"
    },
    "3.9.0": {
      "content": "sha256:2fad0a3a0896766c666cbd67cd4d468d4d408db216efb8c5bc224be62095685e",
      "observed": "2026-08-02T13:22:36Z"
    },
    "3.9": {
      "content": "sha256:2fad0a3a0896766c666cbd67cd4d468d4d408db216efb8c5bc224be62095685e",
      "observed": "2026-08-02T13:22:36Z"
    }
  }
}
