{
  "name": "ocx.sh/docker/docker-credential-osxkeychain",
  "repository": "oci://ghcr.io/ocx-contrib/docker/docker-credential-osxkeychain",
  "owners": [
    {
      "github": "ocx-bot",
      "github_id": 309019509
    }
  ],
  "status": "active",
  "deprecated_message": null,
  "created": "2026-08-11",
  "desc": {
    "digest": "sha256:3516555988349277713cda5464b58d323ed0686c46215617891df2870a4d55f9",
    "title": "docker-credential-osxkeychain",
    "description": "Docker credential helper backed by the macOS login Keychain \u2014 keeps registry credentials out of a plaintext config.json. No host setup required.",
    "keywords": [
      "docker",
      "credential-helper",
      "osxkeychain",
      "keychain",
      "macos",
      "darwin",
      "registry",
      "credentials",
      "credsstore",
      "docker-login",
      "security",
      "apple"
    ],
    "readme": "sha256:294127a85e31d234e618b2fb7197f7b56056969c91d9431061d20fed425449d7",
    "logo": "sha256:19d75ed7dc98ed912fc88214ac994f02f5efe9cbc10ef1986b353ffc9747f6a6"
  },
  "upstream": {
    "org": "docker",
    "repository_url": "https://github.com/docker/docker-credential-helpers",
    "disclaimer": "Unaffiliated mirror. docker-credential-helpers is a project of Docker Inc. and contributors; this OCX package republishes upstream release binaries and is not endorsed by them."
  },
  "tags": {
    "0.9.4_20260811": {
      "content": "sha256:5f470c2252dcc5b18bfb2365c0aff2da25b7ea7c70c5e292b25b0929cc601f8c",
      "observed": "2026-08-11T09:40:53Z"
    },
    "0.9.4": {
      "content": "sha256:5f470c2252dcc5b18bfb2365c0aff2da25b7ea7c70c5e292b25b0929cc601f8c",
      "observed": "2026-08-11T09:40:53Z"
    },
    "0.9": {
      "content": "sha256:38ef2937d7bf0936b9790108288b768916aae322d1f464fa281da2ad57244a1b",
      "observed": "2026-08-26T23:58:15Z"
    },
    "0": {
      "content": "sha256:38ef2937d7bf0936b9790108288b768916aae322d1f464fa281da2ad57244a1b",
      "observed": "2026-08-26T23:58:15Z"
    },
    "latest": {
      "content": "sha256:38ef2937d7bf0936b9790108288b768916aae322d1f464fa281da2ad57244a1b",
      "observed": "2026-08-26T23:58:15Z"
    },
    "0.9.5_20260811": {
      "content": "sha256:df9b1986a4af878044f30012c59b32270355f8d950af30a31702f4b7636531de",
      "observed": "2026-08-11T09:40:53Z"
    },
    "0.9.5": {
      "content": "sha256:df9b1986a4af878044f30012c59b32270355f8d950af30a31702f4b7636531de",
      "observed": "2026-08-11T09:40:53Z"
    },
    "0.9.6_20260811": {
      "content": "sha256:a986045d11ab54fb275cca3f8da7d6e3c08c0265384a2c7550686c9990defdad",
      "observed": "2026-08-11T09:40:53Z"
    },
    "0.9.6": {
      "content": "sha256:a986045d11ab54fb275cca3f8da7d6e3c08c0265384a2c7550686c9990defdad",
      "observed": "2026-08-11T09:40:53Z"
    },
    "0.9.7_20260811": {
      "content": "sha256:ad6d4fa5654f7adea2282b0eec44c2a13536223c1f28081a6ba72bc1aadcceb3",
      "observed": "2026-08-11T09:40:53Z"
    },
    "0.9.7": {
      "content": "sha256:ad6d4fa5654f7adea2282b0eec44c2a13536223c1f28081a6ba72bc1aadcceb3",
      "observed": "2026-08-11T09:40:53Z"
    },
    "0.9.8_20260811": {
      "content": "sha256:2adc46583cc7275a132e5447b652f74f9c45f8a3851a23f538ea31db26653422",
      "observed": "2026-08-11T09:40:53Z"
    },
    "0.9.8": {
      "content": "sha256:2adc46583cc7275a132e5447b652f74f9c45f8a3851a23f538ea31db26653422",
      "observed": "2026-08-11T09:40:53Z"
    },
    "0.8.2_20260811": {
      "content": "sha256:03d15e08a30e43148b26fc1bfba85fa7d382022033b8a7f02354cab1b3dc95d2",
      "observed": "2026-08-11T15:31:49Z"
    },
    "0.8.2": {
      "content": "sha256:03d15e08a30e43148b26fc1bfba85fa7d382022033b8a7f02354cab1b3dc95d2",
      "observed": "2026-08-11T15:31:49Z"
    },
    "0.8": {
      "content": "sha256:03d15e08a30e43148b26fc1bfba85fa7d382022033b8a7f02354cab1b3dc95d2",
      "observed": "2026-08-11T15:31:49Z"
    },
    "0.9.0_20260811": {
      "content": "sha256:2e47c75653df2b96deb9a1d4e17f0a5bcfb5014ee6681e63ddd987861f8f6c34",
      "observed": "2026-08-11T15:31:49Z"
    },
    "0.9.0": {
      "content": "sha256:2e47c75653df2b96deb9a1d4e17f0a5bcfb5014ee6681e63ddd987861f8f6c34",
      "observed": "2026-08-11T15:31:49Z"
    },
    "0.9.1_20260811": {
      "content": "sha256:0bd31d977fa25e62d72e34a9b4f80b7b6b89a474670f689b238c079649c0a6f2",
      "observed": "2026-08-11T15:31:49Z"
    },
    "0.9.1": {
      "content": "sha256:0bd31d977fa25e62d72e34a9b4f80b7b6b89a474670f689b238c079649c0a6f2",
      "observed": "2026-08-11T15:31:49Z"
    },
    "0.9.2_20260811": {
      "content": "sha256:729f35c33b71297dd99c7dc4537a9279c8d5014222b559529dc62abe58869f4a",
      "observed": "2026-08-11T15:31:49Z"
    },
    "0.9.2": {
      "content": "sha256:729f35c33b71297dd99c7dc4537a9279c8d5014222b559529dc62abe58869f4a",
      "observed": "2026-08-11T15:31:49Z"
    },
    "0.9.3_20260811": {
      "content": "sha256:25ebc30eb39b460fe8774a21eab09659021798436d532cabf38ed1e793b7d745",
      "observed": "2026-08-11T15:31:49Z"
    },
    "0.9.3": {
      "content": "sha256:25ebc30eb39b460fe8774a21eab09659021798436d532cabf38ed1e793b7d745",
      "observed": "2026-08-11T15:31:49Z"
    },
    "0.8.0_20260811": {
      "content": "sha256:7148cf9882de71fd1de3c715ef015a86af58a3ef3147d6388ac70ebbd57210ec",
      "observed": "2026-08-11T21:24:21Z"
    },
    "0.8.0": {
      "content": "sha256:7148cf9882de71fd1de3c715ef015a86af58a3ef3147d6388ac70ebbd57210ec",
      "observed": "2026-08-11T21:24:21Z"
    },
    "0.8.1_20260811": {
      "content": "sha256:4da66310af9c1941107f020aecd781a056abcb016812ec6dca721ab740815423",
      "observed": "2026-08-11T21:24:21Z"
    },
    "0.8.1": {
      "content": "sha256:4da66310af9c1941107f020aecd781a056abcb016812ec6dca721ab740815423",
      "observed": "2026-08-11T21:24:21Z"
    },
    "0.9.9_20260826": {
      "content": "sha256:38ef2937d7bf0936b9790108288b768916aae322d1f464fa281da2ad57244a1b",
      "observed": "2026-08-26T23:58:15Z"
    },
    "0.9.9": {
      "content": "sha256:38ef2937d7bf0936b9790108288b768916aae322d1f464fa281da2ad57244a1b",
      "observed": "2026-08-26T23:58:15Z"
    }
  }
}
